resolucion,identificador,resumen,Estado,
Resolución 18 de 2024 de Ministerio del Transporte,GOC-2024-403-O70,"Declara a las Bases de Pesca Deportivo-Recreativas, como puertos pesqueros de interés local, subordinados a los gobiernos municipales.",No disponible,
Decreto Ley 60 de 2022 de Consejo de Estado,GOC-2022-499-EX32,"""Del reconocimiento del tiempo de servicios para el otorgamiento de las pensiones a los pescadores comerciales""",No disponible,
Resolución 382 de 2021 de Ministerio de Finanzas y Precios,GOC-2021-866-O107,Establece la forma de pago del Impuesto sobre los Ingresos Personales y la Contribución Especial de la Seguridad Social para los trabajadores por cuenta propia que ejercen la pesca comercial.,No disponible,
Resolución 38 de 2021 de Ministerio de la Industria Alimentaria,GOC-2021-425-O47,Declara los embalses de interés para la pesca comercial estatal acuícola que ejecutan las empresas integradas al Grupo Empresarial de la Industria Alimentaria y permite otros tipos de pesca que puede realizarse en dichos embalses.,No disponible,
Resolución 37 de 2021 de Ministerio de la Industria Alimentaria,GOC-2021-424-O47,Declara los embalses en los que puede practicarse la pesca estatal acuícola y la pesca deportiva y recreativa.,No disponible,
Resolución 36 de 2021 de Ministerio de la Industria Alimentaria,GOC-2021-423-O47,Aprueba el “Procedimiento para el otorgamiento de autorizaciones de pesca en la República de Cuba”.,Derogada,
Decreto 1 de 2019 de Consejo de Ministros,GOC-2020-112-O11,"REGLAMENTO DE LA LEY 129 “LEY DE PESCA” Establece las regulaciones y los procedimientos para la administración, conservación y explotación económica sostenible de los recursos hidrobiológicos y en especial de los pesqueros, en las aguas marítimas, fluviales y lacustres de la República de Cuba.",No disponible,
Ley 129 de 2019 de Asamblea Nacional del Poder Popular,GOC-2020-111-O11,"LEY DE PESCA Establece las regulaciones para el adecuado ordenamiento, administración y control de la pesca, en función de la conservación y el aprovechamiento racional de los recursos hidrobiológicos en las aguas marítimas, fluviales y lacustres de la República de Cuba, con el fin de contribuir a la soberanía alimentaria de la nación.",No disponible,
Resolución 353 de 2010 de Ministerio de la Industria Alimentaria,No disponible,"Actualiza y pone en vigor en todo el territorio nacional los requisitos que deberán cumplir las personas naturales cubanas al solicitar la Licencia de Pesca Comercial Privada, así como las tarifas oficiales anuales que abonarán una vez aprobada la solicitud.",Derogada,