resolucion,identificador,resumen,Estado,
Resolución 164 de 2004 de Ministerio de la Industria Pesquera,GOC-2004-959-O54,"Establece 74 milímetros de largo del cefalotórax (carapacho), como talla mínima legal para la captura de la especie Panulirus argus (Langosta Común).",No disponible,
Resolución 96 de 2004 de Ministerio de la Industria Pesquera,GOC-2004-557-EX6,"Prohíbe toda la actividad pesquera durante los 10 días del cuarto creciente a la luna llena de los meses de abril, mayo y junio.",No disponible,
Resolución 58 de 2004 de Ministerio de la Industria Pesquera,GOC-2004-356-EX5,"Prohíbe la práctica de la pesca comercial con tranques, corrales, redes de sitio o cualquier otro tipo de arte de pesca similar, en las aguas marítimas cubanas en el período que abarca desde el 1ro. de abril del 2004 hasta el 31 de agosto del propio año.",No disponible,
Resolución 54 de 2005 de Ministerio de la Industria Pesquera,GOC-2005-653-O31,Establece Límites en las Zonas de Pesca de todas las Empresas que se dedican a la captura de la langosta.,No disponible,
Resolución 334 de 2004 de Ministerio de la Industria Básica,GOC-2005-160-08,"Prohíbe la práctica de la pesca comercial con tranques, corrales, redes de sitio o cualquier otro tipo de arte de pesca similar, en las aguas marítimas cubanas en el período que abarca desde el 1ero. de enero del 2005 hasta el 31 de diciembre de este mismo año.",No disponible,
Resolución 266 de 2004 de Ministerio de la Industria Pesquera,GOC-2005-40-O2,"Prohibe la colecta, transportación, tenencia y cualquier otra actividad que implique la extracción de ejemplares de la especie, Cassis madagascariensis, comúnmente conocida como quinconte, en cualquiera de las etapas de su ciclo de vida, a nivel nacional.",No disponible,
Resolución 130 de 2008 de Ministerio de la Industria Pesquera,GOC-2008-795-O42,"Prohibe la práctica de la pesca comercial con tranques, corrales, redes de sitio o cualquier tipo de arte de pesca similar, en las aguas marítimas cubanas de manera permanente.",No disponible,
Resolución 187 de 2008 de Ministerio de la Industria Pesquera,GOC-2008-1214-O56,Modifica el Apartado Primero y Segundo de la Resolución No. 96 de 29 de marzo de 2006 sobre las Zonas Bajo Régimen Especial de Uso y Protección y la prohibición de captura de la especie Panulirus Argus.,No disponible,
Resolución 128 de 2008 de Ministerio de la Industria Pesquera,GOC-2008-663-O35,Establece prohibición de toda actividad pesquera en un área definida por determinada fecha.,No disponible,
Resolución 9 de 2008 de Ministerio de la Industria Pesquera,GOC-2008-114-EX8,"Establece en todo el territorio nacional una veda de carácter permanente para los quelonios marinos denominados tortuga verde (chelonia mydas), caguama (caretta caretta), carey (eretmochelys) y tinglado (dermochelys coriácea).",No disponible,
Resolución 47 de 2021 de Ministerio de la Industria Alimentaria,GOC-2021-407-O44,Establece la talla mínima de captura para determinadas especies de esponjas de mar.,No disponible,
Resolución  de 2021 de Ministerio de la Industria Alimentaria,GOC-2021-407-O44,Establece la talla mínima de captura para determinadas especies de esponjas de mar.,No disponible,
Resolución 45 de 2021 de Ministerio de la Industria Alimentaria,GOC-2021-405-O44,"Establece la prohibición de la pesca dirigida a las especies de loros y barberos en todo el territorio nacional, excepto en la modalidad de pesca de investigación.",No disponible,
Resolución 44 de 2021 de Ministerio de la Industria Alimentaria,GOC-2021-404-O44,Establece la prohibición de la captura de peces en determinados polígonos y los períodos de esta.,No disponible,
Resolución 7 de 2020 de Ministerio del Interior,GOC-2020-119-O11,"Designa las zonas en las que las Tropas Guardafronteras actúan fundamentalmente y establece la obligación del Ministerio del Interior de informar mensualmente al Ministerio de la Industria Alimentaria los datos de los infractores del régimen de pesca, las medidas aplicadas y el nombre de las embarcaciones vinculadas a la violación.",Derogada,
Decreto 1 de 2019 de Consejo de Ministros,GOC-2020-112-O11,"REGLAMENTO DE LA LEY 129 “LEY DE PESCA” Establece las regulaciones y los procedimientos para la administración, conservación y explotación económica sostenible de los recursos hidrobiológicos y en especial de los pesqueros, en las aguas marítimas, fluviales y lacustres de la República de Cuba.",No disponible,
Ley 129 de 2019 de Asamblea Nacional del Poder Popular,GOC-2020-111-O11,"LEY DE PESCA Establece las regulaciones para el adecuado ordenamiento, administración y control de la pesca, en función de la conservación y el aprovechamiento racional de los recursos hidrobiológicos en las aguas marítimas, fluviales y lacustres de la República de Cuba, con el fin de contribuir a la soberanía alimentaria de la nación.",No disponible,
Resolución 133 de 2017 de Ministerio de la Industria Alimentaria,No disponible,"Prohíbe la pesca con redes en la Bahía de Nazabal a todas las embarcaciones, exceptuando aquellas pertenencientes a la Empresa Pesquera Industrial de Caibarién, en forma abreviada EPICAI, que se autoricen mediante la presente.",No disponible,
Resolución 73 de 2015 de Ministerio de la Industria Alimentaria,No disponible,Prohibe la actividad pesquera de la especie biajaiba en determinadas zonas y durante el período del 26 de abril al 6 d mayo y entre el 25 de mayo y el 4 de junio.,No disponible,
Resolución 183 de 2008 de Ministerio de la Industria Pesquera,GOC-2008-1124-O53,Declara como Zona Bajo Régimen Especial de Uso y Protección las áreas marinas del Refugio de Fauna Las Loras.,Derogada,
Resolución 345 de 2001 de Ministerio de la Industria Pesquera,GOC-2002-90-O7,"Prohibe totalmente la celebración de cualquier tipo de evento competitivo relacionado con la pesca submarina, en todo el territorio nacional.",Derogada,
Resolución 479 de 2009 de Ministerio de la Industria Alimentaria,No disponible,"Concluye el periodo de veda establecido para la especie comúnmente denominada camarón rosado Farfantepenaeus notialis, y establece otras cuestiones a tener en cuenta por empresas autorizadas en cuanto a la pesca y las prohibiciones a esta.",No disponible,
Resolución 355 de 2010 de Ministerio de la Industria Alimentaria,No disponible,"Concluye la pesquería en toda la plataforma sur oriental de Cuba para la especie Farfantepaeus notialis, comúnmente conocida como camarón rosado en un período determinado en esta Resolución.",No disponible,
Resolución 252 de 2014 de Ministerio de la Industria Alimentaria,No disponible,"Prohibición del aleteo de tiburón, que consiste en cortar las aletas, desechando el resto del cuerpo del animal.",No disponible,
Resolución 257 de 2010 de Ministerio de la Industria Alimentaria,No disponible,"Prohibe toda actividad pesquera para la Plataforma sur occidental del país, conocida como ZONA B y para la Plataforma norte centro oriental, conocida como Zona D, en el tiempo que establece la Resolución, entre otras cuestiones relativas al tema",No disponible,
Resolución 274 de 2013 de Ministerio de la Industria Alimentaria,No disponible,"Prohibe la actividad pesquera en el área comprendida dentro de determinado polígono en la plataforma Suroccidental, en los días del cuarto creciente a la luna llena, del 17 al 28 de mayo y del 15 al 25 de junio del año 2013",No disponible,
Resolución 85 de 2014 de Ministerio de la Industria Alimentaria,No disponible,Prohibe la actividad pesquera en el área comprendida dentro de determinado polígono y autoriza la pesca fuera de dicho polígono a determinad número y tipo de embarcaciones.,No disponible,
Resolución 503 de 2012 de Ministerio de la Industria Alimentaria,No disponible,Prohíbe el uso del chinchorro escamero de arrastre en la plataforma marina de todo el territorio nacional.,Derogada,
Resolución 236 de 2012 de Ministerio de la Industria Alimentaria,No disponible,"Prohibe la actividad pesquera en determinadas áreas, así como la captura y desembarque de la especie biajaiba para la plataforma sur oriental.",No disponible,
Resolución 116 de 2009 de Ministerio de la Industria Alimenticia,No disponible,"Suspende el uso de artes masivas de arrastre en las pesquerías que se realizan en la zona del Canal de Boca Grande, del área protegida Jardines de la Reina.",No disponible,
Resolución 126 de 2009 de Ministerio de la Industria Alimenticia,No disponible,"Prohíbe en todo el territorio nacional la captura, el desembarque, la transportación y la comercialización de aquellas especies acuáticas de la plataforma marina cubana, cuyas tallas mínimas se encuentren por debajo de lo establecido. Esta prohibición se hace extensiva a la captura y el desembarque del producto de la pesca comercial privada y la pesca deportiva recreativa.",No disponible,
Resolución 109 de 2009 de Ministerio de la Industria Alimenticia,No disponible,"Establece determinadas autorizaciones y prohibiciones pesqueras, para períodos específicos del año.",No disponible,